### ISSUE TITLE
Unreachable VMs after a time

### ISSUE THREAD

**Issue by PlagueCZ** [ironcore-dev/dpservice#223]
After a relatively long runtime, some VMs stop responding in k8s (this image is an older instance of the bug, just for illustration)
<img width="1403" alt="Bildschirm_foto 2023-02-25 um 00 53 24" src="https://user-images.githubusercontent.com/4085523/222153178-1338bebc-5e0f-446f-92c6-e14921e23104.png">

I am putting together outputs from last night, so the quality is not that high (i.e. the outputs do not match in sequence numbers), I'll try to get more data after reproducing this today.

By running a ping from another host's VM (192.168.20.16) to the unresponding VM (192.168.20.18), we can see by using tcpdump on both hosts and on the routers, that the packet goes from VM to dp-service, gets encapsulated:
```
root@mdb3-vm1-n3:/# tcpdump -i mlx5_0 -n | grep 192.168.20.16 | grep 192.168.20.18
01:03:23.315591 IP 192.168.20.16 > 192.168.20.18: ICMP echo request, id 24624, seq 1054, length 64
01:03:23.315611 IP6 2a00:da8:fff6:3405:: > 2a00:da8:fff6:1403:0:ca::: IP 192.168.20.16 > 192.168.20.18: ICMP echo request, id 24624, seq 1054, length 64
01:03:24.339609 IP 192.168.20.16 > 192.168.20.18: ICMP echo request, id 24624, seq 1055, length 64
01:03:24.339629 IP6 2a00:da8:fff6:3405:: > 2a00:da8:fff6:1403:0:ca::: IP 192.168.20.16 > 192.168.20.18: ICMP echo request, id 24624, seq 1055, length 64
```
The packet then arrives at the right host, but there is no communication of the decapsulated packet to the target VM:
```
root@mdb1-vm1-n1:/# tcpdump -i mlx5_1 host 2a00:da8:fff6:3405:: -n
01:56:03.032338 IP6 2a00:da8:fff6:3405:: > 2a00:da8:fff6:1403:0:ca::: IP 192.168.20.16 > 192.168.20.18: ICMP echo request, id 54094, seq 2532, length 64
01:56:04.056449 IP6 2a00:da8:fff6:3405:: > 2a00:da8:fff6:1403:0:ca::: IP 192.168.20.16 > 192.168.20.18: ICMP echo request, id 54094, seq 2533, length 64
01:56:05.080371 IP6 2a00:da8:fff6:3405:: > 2a00:da8:fff6:1403:0:ca::: IP 192.168.20.16 > 192.168.20.18: ICMP echo request, id 54094, seq 2534, length 64
```
Unfortunately I can currently neither confirm nor deny that the other VMs on the same host are working or not.
